1482895001180856320	mergershark	2022-01-17 01:58:13+00:00	Twitter for Android	None	None	None	0	RT @Die_Alexs: Die #OEVP hat uns alle so gut wie immer angelogen Und sie hören wie alle mitbekommen nicht damit auf Und denen traut ihr ei…
1482894882071097351	JohannesMirwald	2022-01-17 01:57:45+00:00	Twitter for Android	None	None	None	0	RT @MaxlWerner: Nicht auf die Intensivstation zu müssen, scheint mir eine sehr sinnvolle Nebenwirkung der Impfung zu sein. #ImZentrum
1482893511091490816	jfohringer	2022-01-17 01:52:18+00:00	Twitter for Android	None	None	None	0	RT @Robert_V_Schuh: #imzentrum Petrovic is der Großen Verschwörung auf der Spur... Schwurbel Schwurbel bla bla bla...
1482890313429626881	ma_am_42_21	2022-01-17 01:39:36+00:00	Twitter for iPad	None	None	None	0	RT @Natascha_Strobl: Petrovic betreibt klassische Desinformation und verdreht Tatsachen. Sie nimmt einen Passus heraus und suggeriert, dass…
1482890053433151490	ma_am_42_21	2022-01-17 01:38:34+00:00	Twitter for iPad	None	None	None	0	RT @senad_lacevic: Warum Leute wie #Petrovic zu Sendungen wie #imzentrum eingeladen werden? Sie bedeuten Interaktion, Aufregung und Interes…
1482889680672763911	ma_am_42_21	2022-01-17 01:37:05+00:00	Twitter for iPad	None	None	None	0	RT @Natascha_Strobl: Es ist ein Wahnsinn, dass Reiterer so fragt, ob die Impfung überhaupt schützt. Es ist längst belegt. Millionen Mal. Un…
1482889542399107081	ma_am_42_21	2022-01-17 01:36:32+00:00	Twitter for iPad	None	None	None	0	RT @liabellafi: In welcher Funktion ist Madeleine Petrovic bei #imZentrum?
1482889258193010695	ma_am_42_21	2022-01-17 01:35:24+00:00	Twitter for iPad	None	None	None	0	RT @Natascha_Strobl: Petrovic spielt jetzt 1:1 die Narrative der Verschwörungsszene wieder. Sie tut so als sei „die bedingte Zulassung“ etw…
1482887462464720902	WernerJugl	2022-01-17 01:28:16+00:00	Twitter for Android	None	None	None	0	RT @JaMoEberl: Weil man #Impfgegner*innen &amp; #Coronaleugner*innen zu solchen Formaten einlädt, werden wir auch nach Jahren der Pandemie jede…
1482887356902481945	TessaChiara	2022-01-17 01:27:51+00:00	Twitter for iPhone	None	None	None	0	RT @PaulReisenauer: Ich habe jetzt #Petrovic auf FB geschrieben: "Frau Petrovic vielen Dank für ihre Arbeit!!! Es wird so viel über die Neb…
1482886590531842055	jfohringer	2022-01-17 01:24:48+00:00	Twitter for Android	None	None	None	0	RT @SchnablFranz: Man hätte Frau Petrovic zu Beginn mit ihren abstrusen Aussagen konfrontieren müssen, nicht die Bühne für weitere bereiten…
1482884738587185157	DerFrDemokrat	2022-01-17 01:17:27+00:00	Twitter Web App	None	None	None	0	Kommt so etwas auch in der ÖVP vor?😇😇😇https://t.co/ImnO1RjkLt #imzentrum #Impfpflicht #zib2 Petrovic
1482884494109589505	WernerJugl	2022-01-17 01:16:28+00:00	Twitter for Android	None	None	None	0	RT @Bini_Guttmann: Abgesehen von allem anderen, dass Petrović nicht darauf angesprochen wurde, dass sie gestern auf einer rechtsextremen Ku…
1482883729848774667	Inku_Lux	2022-01-17 01:13:26+00:00	Twitter for iPhone	None	None	None	0	RT @Natascha_Strobl: Petrovic betreibt klassische Desinformation und verdreht Tatsachen. Sie nimmt einen Passus heraus und suggeriert, dass…
1482881045792018433	angela79at	2022-01-17 01:02:46+00:00	Twitter Web App	None	None	None	0	RT @PeterBussjaeger: In dem Punkt, dass über den Einspruch eine höhere Strafe rauskommen kann als in der Impfstrafverfügung verhängt, gebe…
1482878496682692610	Mhs_ThatFace	2022-01-17 00:52:38+00:00	Twitter for iPhone	None	None	None	0	RT @allesmittelgrau: Drei Mal dürft ihr raten wer nicht geimpft ist. #imzentrum https://t.co/Ra0cpn7AWF
1482876931049721859	KBeclin	2022-01-17 00:46:25+00:00	Twitter Web App	None	None	None	0	RT @PeterBussjaeger: In dem Punkt, dass über den Einspruch eine höhere Strafe rauskommen kann als in der Impfstrafverfügung verhängt, gebe…
1482876405360824336	Mhs_ThatFace	2022-01-17 00:44:20+00:00	Twitter for iPhone	None	None	None	0	RT @HMissethon: Solange @reiterec Gäste wie #Petrovic einlädt, werde ich #imzentrum boykottieren.😠 Die Einladungspolitik ist nicht mehr ser…
1482876400046678017	Mhs_ThatFace	2022-01-17 00:44:18+00:00	Twitter for iPhone	None	None	None	0	RT @MaxlWerner: Nicht auf die Intensivstation zu müssen, scheint mir eine sehr sinnvolle Nebenwirkung der Impfung zu sein. #ImZentrum
1482876262830026760	arkoliest	2022-01-17 00:43:46+00:00	Twitter Web App	None	None	None	0	RT @art18bvg: Was #imzentrum hier macht, kann ich nur mehr als zynisch bezeichnen. Fpr die Quote lädt man Leute ein, die null Expertise hab…
1482874941401927682	SusanneDrothler	2022-01-17 00:38:31+00:00	Twitter for iPhone	None	None	None	0	Wie ist das jetzt eigentlich? Ist Madeleine #Petrovic rechtextrem? #ImZentrum #w1501
1482874940797992961	RealB11529_AT	2022-01-17 00:38:31+00:00	Twitter for Android	None	None	None	0	RT @brosch_alex: Petrovic ist nicht die erste SchwurblerIn, die vom @ORF eine Bühne geboten bekommt. Ad Hoc fallen mir ein: Sönnichsen, Gue…
1482874477574819841	DerKeiler	2022-01-17 00:36:40+00:00	Twitter for iPad	None	None	None	0	RT @PatrickGruska: Sich seriös mit einem Thema zu beschäftigen und gleichzeitig dann "alle sind von Gates bezahlt" sagen geht sich genau wi…
1482874284599136256	_markus_aut_	2022-01-17 00:35:54+00:00	Twitter for Android	None	None	None	0	RT @MaxlWerner: Nicht auf die Intensivstation zu müssen, scheint mir eine sehr sinnvolle Nebenwirkung der Impfung zu sein. #ImZentrum
1482873682993291270	kuruknai	2022-01-17 00:33:31+00:00	Twitter for Android	None	None	None	0	#imzentrum Wenn du deine Verschwörungsmythen sicherheitshalber vom Zettel abliest, damit du nichts Falsches sagst: https://t.co/rpRHGmQ0Ux
1482873640672808963	SchlossnicklJac	2022-01-17 00:33:21+00:00	Twitter Web App	None	None	None	0	#imzentrum Du sollst nicht Im Zentrum nachschauen! Jetzt habe ich eine neue Allergie, ein Magengeschwür, und mir ist so schlecht. Danke Frau Petrovic! 💩💩💩💩💩💩💩
1482871522914148357	SchlossnicklJac	2022-01-17 00:24:56+00:00	Twitter Web App	None	None	None	0	#imzentrum Petrovic als Bhakdi 🤪 https://t.co/59kSVd1S85
1482871138451660806	TopSellingg	2022-01-17 00:23:24+00:00	Twitter Web App	None	None	None	1	https://t.co/iklyvECiXI Smart 3D TV 300inch Android WiFi Full HD For 4K Cinema #SecretNoche1 #ALGEGQ #SFvsDAL #FTTB #PHIvsTB #ONStorm #Canucks #sterntv #DankeKarl #ranNFL #ranNFL #IchbinStaatsfeind #Tatort #imzentrum #Impfpflicht #w1501 #zib2 #fypシ #fyptt #fyptiktok #viral https://t.co/ISMxPLbZJE
1482870464498315264	marcus_didius	2022-01-17 00:20:43+00:00	Twitter for iPhone	None	None	None	0	RT @i_am_fabs: Ich habs eh schon zigfach gesagt; Nein, ORF, ihr braucht solche Leute nicht einladen. Ich verstehe es auch nicht warum ihr e…
1482870025442758657	alwynmattathil	2022-01-17 00:18:59+00:00	Twitter for Android	None	None	None	0	RT @Natascha_Strobl: Petrovic betreibt klassische Desinformation und verdreht Tatsachen. Sie nimmt einen Passus heraus und suggeriert, dass…
1482868908256337927	alwynmattathil	2022-01-17 00:14:32+00:00	Twitter for Android	None	None	None	0	RT @bertieroberts54: Soweit ich mitbekommen habe, ist Fr. Petrovic in Pension. Endlich Zeit zu reisen, mit den Enkerln Zeit verbringen, das…
1482868456399720449	IreneKegler	2022-01-17 00:12:45+00:00	Twitter for Android	None	None	None	0	RT @PeterBussjaeger: In dem Punkt, dass über den Einspruch eine höhere Strafe rauskommen kann als in der Impfstrafverfügung verhängt, gebe…
1482868290636689411	linksbazi	2022-01-17 00:12:05+00:00	Twitter for Android	None	None	None	0	RT @Natascha_Strobl: Griss ist eine geschickte Diskutantin. Nimmt sich das Schlusswort, lobt Wiedemann-Schmidt, bleibt kritisch zur Regieru…
1482867490698842113	DerMaerzAT	2022-01-17 00:08:54+00:00	Twitter for Android	None	None	None	0	RT @buerstmayr: Das ist schon schlimm, was #Petrovic da alles an Falschbehauptungen in EINEM statement #imzentrum abliefert, sorry to say s…
1482867386688622595	alwynmattathil	2022-01-17 00:08:29+00:00	Twitter for Android	None	None	None	0	RT @KatQuat: mein impfpass is voller pickerl und fett wie halbe telefonbuch. ja so is wemma fernreise macht und HALT EINFACH NET KREPIEREN…
1482867333869809666	_l17r_	2022-01-17 00:08:17+00:00	Fenix 2	None	None	None	0	RT @Natascha_Strobl: Griss ist eine geschickte Diskutantin. Nimmt sich das Schlusswort, lobt Wiedemann-Schmidt, bleibt kritisch zur Regieru…
1482867061059727360	Max62153089	2022-01-17 00:07:12+00:00	Twitter for iPhone	None	None	None	0	RT @hofrat: Was denken eigentlich die vielen vernünftigen ORF-Journalist*innen, Redaktionsleitungen und Chefredaktionen, wenn ihre Kollegin…
1482867044366401538	SchlossnicklJac	2022-01-17 00:07:08+00:00	Twitter Web App	None	None	None	0	Bitte liebe @diegruenen Bitte Frau Madeleine Petrovic aus der Partei ausschließen. Mir tut alles weh wenn sie spricht! #imzentrum
1482866967409270787	HermineHase	2022-01-17 00:06:50+00:00	Twitter for iPhone	None	None	None	0	RT @WernerReisinger: ich finde das ehrlich gesagt auch den #grüne n gegenüber nicht redlich. mag sein, dass in ihrem milieu viele probleme…
1482866961516273666	Max62153089	2022-01-17 00:06:48+00:00	Twitter for iPhone	None	None	None	0	RT @ConradsHeinz: Bei #imzentrum ist die #grüne Impfgegnerin #Petrovic via Bildschirm zugeschaltet. Vermutlich kann sie die geltenden #Covi…
1482866538801766400	TristanBrucker	2022-01-17 00:05:07+00:00	Twitter for Android	None	None	None	0	RT @MaxlWerner: Können wir klären, was an der Kulisse "Dann haben wir die fünfte und sechste Impfung" bzw. an der Kulisse "Dann haben wir e…
1482866427254263808	Max62153089	2022-01-17 00:04:41+00:00	Twitter for iPhone	None	None	None	0	RT @SherlockH85: Auf ORF 2 sitzen Griss und Petrovic, auf Servus TV sitzt das kastrierte Pferd 🤦‍♂️ #imzentrum #lrm https://t.co/Bt465fg7yf
1482865873832529920	SchlossnicklJac	2022-01-17 00:02:29+00:00	Twitter Web App	None	None	None	0	#imzentrum Petrovic nicht physisch anwesend, auch bezeichnend! Verweigert sicher COViD Test!
1482865352321208325	VillacoConvenio	2022-01-17 00:00:24+00:00	Twitter for iPhone	None	None	None	0	RT @Natascha_Strobl: Es ist ein Wahnsinn, dass Reiterer so fragt, ob die Impfung überhaupt schützt. Es ist längst belegt. Millionen Mal. Un…
1482864027894267906	alwynmattathil	2022-01-16 23:55:09+00:00	Twitter for Android	None	None	None	0	RT @AmsHeier: Ausnahmsweise tut mir die Politik leid, die die Aufgabe hat, ein Volk von Idioten durch diese Krise zu bringen. Unsolidarisch…
1482863287561773058	Werner_Beninger	2022-01-16 23:52:12+00:00	Twitter Web App	None	None	None	0	RT @WernerReisinger: ich finde das ehrlich gesagt auch den #grüne n gegenüber nicht redlich. mag sein, dass in ihrem milieu viele probleme…
1482862624266194944	trading_1123	2022-01-16 23:49:34+00:00	Twitter for iPhone	None	None	None	0	Frau Petrovic ist der Beweis, dass noch nicht alle bei den @diegruenen den Verstand verloren haben. Ihre Argumente haben 💯 ins Schwarze getroffen und werden von den meisten auch nicht verstanden. Wer das nicht hören will, betreibt Vogel-Strauß-Politik #imzentrum #Impfpflicht
1482862586253254657	kotzlpotzl	2022-01-16 23:49:25+00:00	Twitter for Android	None	None	None	0	RT @Natascha_Strobl: Petrovic wieder im Angst-Modus. Die Nebenwirkungen seien krass unterschätzt. Auch das ist natürlich direkt aus der Ver…
1482862585993220099	chrissi_syro	2022-01-16 23:49:25+00:00	Twitter Web App	None	None	None	0	RT @Shirleyinaktiv: Der ORF hat in 25 Jahren wenig dazugelernt und lädt die Schwurblerin #Petrovic zu #imzentrum ein. Der Spiegel hat 19…
1482862340093714433	ofri_ofriedrich	2022-01-16 23:48:26+00:00	Twitter for iPhone	None	None	None	0	RT @Bini_Guttmann: Abgesehen von allem anderen, dass Petrović nicht darauf angesprochen wurde, dass sie gestern auf einer rechtsextremen Ku…
1482862023952191496	top_secret_user	2022-01-16 23:47:11+00:00	Twitter for Android	None	None	None	0	RT @art18bvg: Was #imzentrum hier macht, kann ich nur mehr als zynisch bezeichnen. Fpr die Quote lädt man Leute ein, die null Expertise hab…
1482862014405951489	top_secret_user	2022-01-16 23:47:09+00:00	Twitter for Android	None	None	None	0	RT @art18bvg: Die Impfquote stockt, deshalb sterben noch Menschen, die das nicht müssten, wir führen ne Impfpflicht ein und zig Menschen ve…
1482861887780012036	alwynmattathil	2022-01-16 23:46:38+00:00	Twitter for Android	None	None	None	0	RT @Natascha_Strobl: Griss ist eine geschickte Diskutantin. Nimmt sich das Schlusswort, lobt Wiedemann-Schmidt, bleibt kritisch zur Regieru…
1482861694326124545	GudrunRossmann	2022-01-16 23:45:52+00:00	Twitter for iPhone	None	None	None	0	RT @Natascha_Strobl: Petrovic betreibt klassische Desinformation und verdreht Tatsachen. Sie nimmt einen Passus heraus und suggeriert, dass…
1482861511727104010	KnutOgris	2022-01-16 23:45:09+00:00	Twitter for Android	None	None	None	0	RT @Natascha_Strobl: Vier Expert_innen und eine Person, die nur dazu da ist maximalistische Angstmacherei zu betreiben. Schönes Setting. #i…
1482861118003597318	grafkaroly	2022-01-16 23:43:35+00:00	Twitter Web App	None	None	None	0	RT @bloiner: Was passiert wenn ich mich brav boostern lasse aber mich weigere irgendetwas zu unterschreiben. Was ich weiß ist das dir einzi…
1482860978194763779	grafkaroly	2022-01-16 23:43:02+00:00	Twitter Web App	None	None	None	0	RT @LawinenL: ich bin ein Schwurbler, holt mich hier raus! #imzentrum https://t.co/nHsGoFNaRZ
1482860356359921667	KnutOgris	2022-01-16 23:40:33+00:00	Twitter for Android	None	None	None	0	RT @Natascha_Strobl: Petrovic wieder im Angst-Modus. Die Nebenwirkungen seien krass unterschätzt. Auch das ist natürlich direkt aus der Ver…
1482860329835106304	AmsHeier	2022-01-16 23:40:27+00:00	Twitter Web App	None	None	None	1	Ausnahmsweise tut mir die Politik leid, die die Aufgabe hat, ein Volk von Idioten durch diese Krise zu bringen. Unsolidarisch, ungebildet, besserwisserisch, naziaffin, Pferdeentwurmungsmittelfressend, unfähig seriöse Informationsquellen zu erkennen.. unfaßbar! #imzentrum https://t.co/zWhQ2MEqUv
1482860080592830466	nichtmehrBatman	2022-01-16 23:39:28+00:00	Twitter Web App	None	None	None	0	RT @PaulReisenauer: Ich habe jetzt #Petrovic auf FB geschrieben: "Frau Petrovic vielen Dank für ihre Arbeit!!! Es wird so viel über die Neb…
1482859084059709444	yung_impfling	2022-01-16 23:35:30+00:00	Twitter for iPhone	None	None	None	0	Für Frau Schurblovic! #imzentrum https://t.co/RmH6Yq0KJG
1482858436228435972	roterstoffl	2022-01-16 23:32:56+00:00	Twitter for Android	None	None	None	0	RT @Bini_Guttmann: Abgesehen von allem anderen, dass Petrović nicht darauf angesprochen wurde, dass sie gestern auf einer rechtsextremen Ku…
1482857585191571456	Jankec8	2022-01-16 23:29:33+00:00	Twitter Web App	None	None	None	0	RT @Die_Alexs: Die #OEVP hat uns alle so gut wie immer angelogen Und sie hören wie alle mitbekommen nicht damit auf Und denen traut ihr ei…
1482857503310618624	marcus_didius	2022-01-16 23:29:13+00:00	Twitter for iPhone	None	None	None	0	RT @MaxlWerner: So ein Selbstbewusstsein musst erstmal haben, einem langjährigen Mitglied des Nationalen Impfgremiums und Professorin für V…
1482857495609630730	Alemsheek	2022-01-16 23:29:11+00:00	Twitter for Android	None	None	None	0	RT @MaxlWerner: Können wir klären, was an der Kulisse "Dann haben wir die fünfte und sechste Impfung" bzw. an der Kulisse "Dann haben wir e…
1482857478870163459	marcus_didius	2022-01-16 23:29:07+00:00	Twitter for iPhone	None	None	None	0	RT @MaxlWerner: Können wir klären, was an der Kulisse "Dann haben wir die fünfte und sechste Impfung" bzw. an der Kulisse "Dann haben wir e…
1482857421395611648	marcus_didius	2022-01-16 23:28:54+00:00	Twitter for iPhone	None	None	None	0	RT @SolautSonja: Kann mir bitte irgendwer verraten, welche Relevanz es hat, ob eine grüne Pensionistin mit irgendwas leben kann oder nicht?…
1482857397244862476	marcus_didius	2022-01-16 23:28:48+00:00	Twitter for iPhone	None	None	None	0	RT @zuschoen: ist die petrovic die grüne stenzel? #imzentrum
1482857301522399232	marcus_didius	2022-01-16 23:28:25+00:00	Twitter for iPhone	None	None	None	0	RT @liviaklingl: bei krebsbehandlung und anderen schweren krankheiten habe ich noch nie den vorwurf von reichen pharmakonzernen und "hinter…
1482857156898603008	KnutOgris	2022-01-16 23:27:51+00:00	Twitter for Android	None	None	None	0	RT @PatrickGruska: Sich seriös mit einem Thema zu beschäftigen und gleichzeitig dann "alle sind von Gates bezahlt" sagen geht sich genau wi…
1482856936278274061	_l17r_	2022-01-16 23:26:58+00:00	Twitter for Android	None	None	None	0	RT @stefanct: parteiausschlüsse werden bei den grünen in den landessatzungen geregelt. die regeln in nö siehe unten. der landevorstand best…
1482856859149254662	marcus_didius	2022-01-16 23:26:40+00:00	Twitter for iPhone	None	None	None	0	RT @hofrat: Was denken eigentlich die vielen vernünftigen ORF-Journalist*innen, Redaktionsleitungen und Chefredaktionen, wenn ihre Kollegin…
1482856852023091209	KnutOgris	2022-01-16 23:26:38+00:00	Twitter for Android	None	None	None	0	RT @MaxlWerner: Nicht auf die Intensivstation zu müssen, scheint mir eine sehr sinnvolle Nebenwirkung der Impfung zu sein. #ImZentrum
1482856804375801861	MonikaW75885050	2022-01-16 23:26:26+00:00	Twitter for Android	None	None	None	0	RT @peterholubar: @PatrickGruska Sie hat betont, dass sie als Juristin und Privatperson dort ist. Das ist schwach, weil als Privatperson wä…
1482856662843207692	aka_maskenmann	2022-01-16 23:25:53+00:00	Twitter for Android	None	None	None	0	RT @MaxlWerner: Können wir klären, was an der Kulisse "Dann haben wir die fünfte und sechste Impfung" bzw. an der Kulisse "Dann haben wir e…
1482856550205120513	Jankec8	2022-01-16 23:25:26+00:00	Twitter Web App	None	None	None	0	RT @zimain70: Gesagt, getan! Ach nein, für eventuelle #Impfschäden muss Pfizer wegen des Haftungsausschluss ja gar nicht aufkommen👍🏻 Das is…
1482856537479651334	i_am_fabs	2022-01-16 23:25:23+00:00	Twitter for iPhone	None	None	None	9	Ich habs eh schon zigfach gesagt; Nein, ORF, ihr braucht solche Leute nicht einladen. Ich verstehe es auch nicht warum ihr es macht. Quote? Irgendeinen schwachsinnigen Grund muss es geben warum dies immer und immer wieder passiert. #imzentrum
1482856253521117185	SchlossnicklJac	2022-01-16 23:24:15+00:00	Twitter Web App	None	None	None	0	Auch wenn ich es schon mehrmals geschrieben habe. Egal ob lustig oder ernst. Wer tritt gegen den Freiheitsentzug im #Straßenverkehr (in alle Richtungen Kfz und inkl. Fussgeher) und #Steuer Recht auf. Gibt saftige #Strafen und keinem kratzt das! #Impfpflicht #Imzentrum
1482856030384103425	MathildeNadja	2022-01-16 23:23:22+00:00	Twitter for Android	None	None	None	0	RT @iamtestr: @pablodiabolo ImZentrum schauen wirklich so viele Leute? Das macht mich irgendwie traurig, weil es eine richtig schlechte Di…
1482855967008169988	AlexanderPolli6	2022-01-16 23:23:07+00:00	Twitter for Android	None	None	None	0	RT @Bini_Guttmann: Abgesehen von allem anderen, dass Petrović nicht darauf angesprochen wurde, dass sie gestern auf einer rechtsextremen Ku…
1482855345043263489	rufus0106	2022-01-16 23:20:39+00:00	Twitter Web App	None	None	None	0	RT @Natascha_Strobl: Petrovic spielt jetzt 1:1 die Narrative der Verschwörungsszene wieder. Sie tut so als sei „die bedingte Zulassung“ etw…
1482855289124753410	rufus0106	2022-01-16 23:20:25+00:00	Twitter Web App	None	None	None	0	ORF ist teilweise so kaputt. Das Problem ist, dass die privaten Sender größtenteils noch schlimmer sind. #imzentrum
1482854946471137315	KnutOgris	2022-01-16 23:19:04+00:00	Twitter for Android	None	None	None	0	RT @saboulez: Frau #Petrovic schwurbelt, vermischt unendlich viel Misinformation in einem Statement. Absurd. Frau #WiedermannSchmidt ist d…
1482854928028741639	Randybrandy6	2022-01-16 23:18:59+00:00	Twitter Web App	1482828733698433031	734467133300707329	senad_lacevic	0	@senad_lacevic kasperltheater braucht krokodil. so hat peter huemer schon die besetzung im club 2 argumentiert. wieso der aber um klassen besser als #imzentrum war, harrt noch einer analyse.
1482854743798165509	zimain70	2022-01-16 23:18:15+00:00	Twitter for iPad	None	None	None	1	Gesagt, getan! Ach nein, für eventuelle #Impfschäden muss Pfizer wegen des Haftungsausschluss ja gar nicht aufkommen👍🏻 Das ist ja viel besser als Medikamententests in den Entwicklungsländern! Super🤮#imzentrum #Impfpflicht #Covid_19 #LRM #Corona https://t.co/iS3MZD2VOJ https://t.co/cWefm6xCnO
1482854675703640065	Rubberinchen	2022-01-16 23:17:59+00:00	TweetDeck	None	None	None	0	Übrigens zum Nachlesen: Das Urteil des EGMR in Sachen #VAVŘIČKA AND OTHERS v. THE CZECH REPUBLIC. Der #EGMR hält eine #Impfpflicht für grundsätzlich zulässig. https://t.co/JNfGtSR1bw{%22itemid%22:[%22001-209039%22]} #imzentrum #zib2
1482854577338728448	di0v0n	2022-01-16 23:17:36+00:00	Оwly	None	None	None	0	RT @Natascha_Strobl: Petrovic betreibt klassische Desinformation und verdreht Tatsachen. Sie nimmt einen Passus heraus und suggeriert, dass…
1482854398879535106	pebelsberger	2022-01-16 23:16:53+00:00	Twitter for Android	None	None	None	0	RT @art18bvg: Was #imzentrum hier macht, kann ich nur mehr als zynisch bezeichnen. Fpr die Quote lädt man Leute ein, die null Expertise hab…
1482854034121838593	art18bvg	2022-01-16 23:15:26+00:00	Twitter for Android	1482853471556673539	22533918	art18bvg	8	Was #imzentrum hier macht, kann ich nur mehr als zynisch bezeichnen. Fpr die Quote lädt man Leute ein, die null Expertise haben und lässt sie zur besten Sendezeit über die Wirksamkeit der Impfung schwurbeln. Mir fehlen da echt die Worte. Das ist verantwortungslos. 2/n
1482853654952620032	AmsHeier	2022-01-16 23:13:56+00:00	Twitter Web App	None	None	None	0	#imzentrum ...erschütternd die Petrovic, aber nicht einzige Schwurblerin bei den Grünen
1482853629212213260	HMKnapp	2022-01-16 23:13:49+00:00	Twitter Web App	None	None	None	0	parturiunt montes nascetur ridiculus mus #imzentrum https://t.co/612TBsP07E
1482853471556673539	art18bvg	2022-01-16 23:13:12+00:00	Twitter for Android	None	None	None	7	Die Impfquote stockt, deshalb sterben noch Menschen, die das nicht müssten, wir führen ne Impfpflicht ein und zig Menschen versuchen verzweifelt Leute zur Impfung zu bringen. @reiterec lädt #Petrovic ein #imzentrum, die die Wirksamkeit der Impfung leugnet.Das ist inakzeptabel 1/n
1482853360466546693	marcus_didius	2022-01-16 23:12:45+00:00	Twitter for iPhone	None	None	None	0	RT @KatQuat: wieso ist petrovic nicht im studio und ich stelle diese frage nur weil ich die antwort schon weiß #imzentrum und schon schwur…
1482853197949673483	marcus_didius	2022-01-16 23:12:07+00:00	Twitter for iPhone	None	None	None	0	RT @allesmittelgrau: Drei Mal dürft ihr raten wer nicht geimpft ist. #imzentrum https://t.co/Ra0cpn7AWF
1482852713117409289	TrendingDLand	2022-01-16 23:10:11+00:00	Top Trending Topics Deutschland	None	None	None	0	imzentrum ist nr.8 trending hashtag in DE in letzten 4 Stunden. https://t.co/tfona6K8Bz #imzentrum
1482852666959085572	marcus_didius	2022-01-16 23:10:00+00:00	Twitter for iPhone	None	None	None	0	RT @Bini_Guttmann: Abgesehen von allem anderen, dass Petrović nicht darauf angesprochen wurde, dass sie gestern auf einer rechtsextremen Ku…
1482852613699911686	marcus_didius	2022-01-16 23:09:47+00:00	Twitter for iPhone	None	None	None	0	RT @PaulReisenauer: Ich bin dem ORF wirklich sehr dankbar, dass er mir die Corona Demos ins Wohnzimmer holt. #petrovic #imzentrum
1482852289148772356	abwerzger	2022-01-16 23:08:30+00:00	Twitter for iPhone	None	None	None	0	RT @PeterBussjaeger: In dem Punkt, dass über den Einspruch eine höhere Strafe rauskommen kann als in der Impfstrafverfügung verhängt, gebe…
1482852056432099331	GeorgP22	2022-01-16 23:07:34+00:00	Twitter Web App	None	None	None	0	#imzentrum https://t.co/dTvxkw4IuL
1482851800369836037	johann90522703	2022-01-16 23:06:33+00:00	Twitter for Android	None	None	None	0	RT @Natascha_Strobl: Griss ist eine geschickte Diskutantin. Nimmt sich das Schlusswort, lobt Wiedemann-Schmidt, bleibt kritisch zur Regieru…
1482851662423375873	Jankec8	2022-01-16 23:06:01+00:00	Twitter Web App	None	None	None	0	RT @PeterBussjaeger: In dem Punkt, dass über den Einspruch eine höhere Strafe rauskommen kann als in der Impfstrafverfügung verhängt, gebe…
1482850881670455303	FranzJo24682644	2022-01-16 23:02:54+00:00	Twitter for Android	None	None	None	0	Ob #zib2 oder #imzentrum. Die Moderatorin des Jahres habe ich nicht gesehen.
1482850824220987402	ErlingerMartin	2022-01-16 23:02:41+00:00	Twitter for Android	None	None	None	0	RT @mathiasertl: Dieses "mir fehlen Informationen" und "es ist nicht transparent". Geh bitte veroarschtst mich nicht. Es gibt 1000 Stud…
1482850779635593217	KnutOgris	2022-01-16 23:02:30+00:00	Twitter for Android	None	None	None	0	RT @DorisHelmberger: Großartig wie immer: Irmgard #griss. „Das riesige Glück durch die Impfungen tritt in den Hintergrund, weil davor so vi…
1482850618347819021	KnutOgris	2022-01-16 23:01:52+00:00	Twitter for Android	None	None	None	0	RT @PeterBussjaeger: In dem Punkt, dass über den Einspruch eine höhere Strafe rauskommen kann als in der Impfstrafverfügung verhängt, gebe…
1482850452597362693	docs_wilde	2022-01-16 23:01:12+00:00	Twitter for Android	None	None	None	0	RT @JaMoEberl: Weil man #Impfgegner*innen &amp; #Coronaleugner*innen zu solchen Formaten einlädt, werden wir auch nach Jahren der Pandemie jede…
1482850445324345352	_Herr_G_	2022-01-16 23:01:10+00:00	Twitter Web App	None	None	None	0	RT @Robert_V_Schuh: #imzentrum Werter ORF, warum werden Privatpersonen (eigene Worte!) zu dem Thema Impfpflicht eingeladen? 😎
1482850317117140992	SteinOffice	2022-01-16 23:00:40+00:00	Twitter for iPhone	None	None	None	0	RT @PatrickGruska: Sich seriös mit einem Thema zu beschäftigen und gleichzeitig dann "alle sind von Gates bezahlt" sagen geht sich genau wi…
