1482830322895142916	pia_pe	2022-01-16 21:41:13+00:00	Twitter Web App	None	None	None	0	Wiedermann-Schmidt sagt, die Daten aus England zeigen, dass Personen, die 3 Mal geimpft sind, bei Omikron vor einem schweren Verlauf geschützt sind. Zur Erinnerung: in Ö sind erst 47 Prozent 3 Mal geimpft. #imZentrum
1482830321116762113	roterispe	2022-01-16 21:41:12+00:00	Twitter for Android	1482829436152078343	35846496	Natascha_Strobl	0	@Natascha_Strobl Deshalb heißt die Sendung ja auch #imzentrum und nicht #impfzentrum. Gefühl schlägt Wissenschaft.
1482830314284199941	DerFrDemokrat	2022-01-16 21:41:11+00:00	Twitter Web App	None	None	None	0	https://t.co/jZP1kzQkHq #imzentrum
1482830294105440258	BerntKoschuh	2022-01-16 21:41:06+00:00	Twitter for Android	None	None	None	0	RT @ORFImZentrum: 💬 "Wenn es zu einer Impfpflicht kommt, dann müssen begleitende Maßnahmen erfolgen: einerseits mit strukturierter Informat…
1482830289055404044	brosch_alex	2022-01-16 21:41:05+00:00	Twitter for Android	None	None	None	0	RT @Natascha_Strobl: Wiedemann-Schmidt wird dadurch in eine Defensiv-Position gebracht. Sie muss sich erstmal erklären. Petrovic durfte aus…
1482830269627392006	grrdrrrbrmpf	2022-01-16 21:41:00+00:00	Twitter for iPhone	None	None	None	0	was ich nicht verstehe..wenn ich so ein Experte bin wie Prof. Kneihs…warum kann ich nicht schnell und effektiv auf solche Fragen antworten? wir wollen nicht einschlafen zu Hause #imzentrum
1482830250790825987	otpast	2022-01-16 21:40:56+00:00	Twitter Web App	None	None	None	0	RT @Natascha_Strobl: Es ist ein Wahnsinn, dass Reiterer so fragt, ob die Impfung überhaupt schützt. Es ist längst belegt. Millionen Mal. Un…
1482830226824511493	kleinowitz	2022-01-16 21:40:50+00:00	Twitter Web App	None	None	None	0	RT @Natascha_Strobl: Petrovic betreibt klassische Desinformation und verdreht Tatsachen. Sie nimmt einen Passus heraus und suggeriert, dass…
1482830224983269383	PeterCScholz	2022-01-16 21:40:49+00:00	Twitter for iPad	None	None	None	0	Schwurbler Wettbewerb heute zwischen #ORF2 und #servusTV. Beides grauslich. Gute Nacht. #imzentrum
1482830220088557570	jahntv	2022-01-16 21:40:48+00:00	Twitter for iPhone	None	None	None	0	RT @MaxlWerner: Nicht auf die Intensivstation zu müssen, scheint mir eine sehr sinnvolle Nebenwirkung der Impfung zu sein. #ImZentrum
1482830194771648512	ReginaZauchner	2022-01-16 21:40:42+00:00	Twitter Web App	None	None	None	0	RT @Natascha_Strobl: Es ist ein Wahnsinn, dass Reiterer so fragt, ob die Impfung überhaupt schützt. Es ist längst belegt. Millionen Mal. Un…
1482830174953553923	RabemaniManuela	2022-01-16 21:40:38+00:00	Twitter Web App	None	None	None	0	RT @Robert_V_Schuh: #imzentrum Werter ORF, warum werden Privatpersonen (eigene Worte!) zu dem Thema Impfpflicht eingeladen? 😎
1482830108800991234	MrUlmrich	2022-01-16 21:40:22+00:00	Twitter Web App	None	None	None	0	Verhindung von Todesfällen. Durch Impfung. #MinorityReport? 😅 #imzentrum
1482830078027382789	splitterfeld	2022-01-16 21:40:14+00:00	Twitter for iPhone	None	None	None	0	Noch Fragen!? #imzentrum https://t.co/Eh3sYEmEcr
1482830077905805324	Natascha_Strobl	2022-01-16 21:40:14+00:00	Twitter for iPhone	1482829436152078343	35846496	Natascha_Strobl	16	Wiedemann-Schmidt wird dadurch in eine Defensiv-Position gebracht. Sie muss sich erstmal erklären. Petrovic durfte aus einer Offensiv-Position erklären. Das macht einen Unterschied. Schon in der Anmoderation. #imzentrum
1482830074659360772	chris1899	2022-01-16 21:40:14+00:00	Twitter for iPhone	None	None	None	0	Ich ertrage solche Personen wie M. Petrovic nicht, ATV bietet mit „ATV Aktuell: Die Woche“ mit Hajek &amp; Hofer das bessere Programm. Vorallem es geht hier um Fakten! #imzentrum
1482830067176816642	TrendingDLand	2022-01-16 21:40:12+00:00	Top Trending Topics Deutschland	None	None	None	0	imzentrum ist nr.9 trending hashtag in DE in letzten 2 Stunden. https://t.co/tfona6K8Bz #imzentrum
1482830053713059847	MonikaW75885050	2022-01-16 21:40:09+00:00	Twitter for Android	None	None	None	0	RT @Natascha_Strobl: Es ist ein Wahnsinn, dass Reiterer so fragt, ob die Impfung überhaupt schützt. Es ist längst belegt. Millionen Mal. Un…
1482830010725675009	SimonTschannett	2022-01-16 21:39:58+00:00	Twitter for iPhone	None	None	None	0	RT @Natascha_Strobl: Es ist ein Wahnsinn, dass Reiterer so fragt, ob die Impfung überhaupt schützt. Es ist längst belegt. Millionen Mal. Un…
1482829972867891209	MaxlWerner	2022-01-16 21:39:49+00:00	Twitter Web App	None	None	None	31	Nicht auf die Intensivstation zu müssen, scheint mir eine sehr sinnvolle Nebenwirkung der Impfung zu sein. #ImZentrum
1482829940286541832	mpopp75	2022-01-16 21:39:42+00:00	Twitter for Android	None	None	None	0	Nicht umsonst nenne ich #imzentrum nur mehr Bullshit-Bingo. @reiterec https://t.co/c0CtXv3hLz
1482829922343297030	What_that_time_	2022-01-16 21:39:37+00:00	Twitter for Android	None	None	None	0	RT @bakhall: Wenn du eine Verfassungsjuristin bei wish bestellst. #imzentrum https://t.co/QKWpRLVPWm
1482829916068589581	thereal_bjoern	2022-01-16 21:39:36+00:00	Twitter for iPhone	None	None	None	0	Ich verstehe noch nicht ganz, was das Tierwohl jetzt mit der Impfpflicht zu tun hat. #imzentrum
1482829885588574208	PhilWe1	2022-01-16 21:39:29+00:00	Twitter for iPhone	None	None	None	0	RT @Natascha_Strobl: Petrovic betreibt klassische Desinformation und verdreht Tatsachen. Sie nimmt einen Passus heraus und suggeriert, dass…
1482829878584090631	GeriDallst	2022-01-16 21:39:27+00:00	Twitter Web App	None	None	None	0	Sollte ich einmal ins "Im Zentrum" eingeladen werden, fahre ich sofort in die SCS und kaufe mir eine lustige Krawatte, ein rosa Hemd und Kindersocken... #imzentrum
1482829863069405190	MrUlmrich	2022-01-16 21:39:23+00:00	Twitter Web App	1482829525247565825	43179319	liabellafi	0	@liabellafi Sie meinte, sie hätt ja nicht so Ahnung. Aber als Juristin, die sie sei, hätt sie scho a Meinung #imzentrum
1482829828357332992	KatQuat	2022-01-16 21:39:15+00:00	Twitter for iPhone	None	None	None	0	RT @Natascha_Strobl: Es ist ein Wahnsinn, dass Reiterer so fragt, ob die Impfung überhaupt schützt. Es ist längst belegt. Millionen Mal. Un…
1482829819540905995	stch62	2022-01-16 21:39:13+00:00	Twitter Web App	None	None	None	0	RT @SabineTreuer: #iz #imzentrum #theater warum ist eine impfpflicht ein eingriff in die menschenrechte,aber eine beschneidung von männl k…
1482829816801943565	pia_pe	2022-01-16 21:39:12+00:00	Twitter Web App	None	None	None	1	Wieso müssen wir hundert Mal durchkauen, ob die Impfungen schützen? Was zum Teufel. #imZentrum
1482829808262332416	JaMoEberl	2022-01-16 21:39:10+00:00	Twitter for iPhone	None	None	None	0	RT @Natascha_Strobl: Es ist ein Wahnsinn, dass Reiterer so fragt, ob die Impfung überhaupt schützt. Es ist längst belegt. Millionen Mal. Un…
1482829784090619907	wischenbart	2022-01-16 21:39:04+00:00	Twitter for Android	None	None	None	0	Bitte was ist #imzentrum für eine #schwurbler Runde?! Es geht beim #Impfpflicht um ein wichtiges und kontroverseses Thema. Aber so geht das nicht.
1482829762297044999	susanne_ruecker	2022-01-16 21:38:59+00:00	Twitter for iPad	None	None	None	0	#imzentrum Warum hat man nicht für den Gesundheitsdienst eine Impfpflicht gemacht. Nun ja, vielleicht weil diese Berufe für extrem schlechte Arbeitsbedingungen extrem schlecht bezahlt werden und Abgänge in andere Branchen kaum nachzubesetzen wären.
1482829762259210246	vintage_to_you	2022-01-16 21:38:59+00:00	Twitter Web App	None	None	None	0	RT @Natascha_Strobl: Petrovic betreibt klassische Desinformation und verdreht Tatsachen. Sie nimmt einen Passus heraus und suggeriert, dass…
1482829755619676163	squadrat	2022-01-16 21:38:58+00:00	TweetDeck	None	None	None	0	RT @TheStyrian: Madeleine Petrovic würde nie in ein Impfzentrum gehen. Auch nicht, wenn's nur so ähnlich klingt. #imzentrum https://t.co/EN…
1482829750875918342	klaaskramer	2022-01-16 21:38:56+00:00	Twitter for iPhone	None	None	None	0	RT @SabineTreuer: #iz #imzentrum #theater warum ist eine impfpflicht ein eingriff in die menschenrechte,aber eine beschneidung von männl k…
1482829709708828680	speis_oo	2022-01-16 21:38:47+00:00	Twitter for Android	None	None	None	0	RT @SabineTreuer: #iz #imzentrum #theater warum ist eine impfpflicht ein eingriff in die menschenrechte,aber eine beschneidung von männl k…
1482829707188047877	anjana_020	2022-01-16 21:38:46+00:00	Twitter Web App	None	None	None	0	Schachtelsätze bei solchen Diskussionen sind grauenvoll 😤#imzentrum
1482829697247596545	los_tomos	2022-01-16 21:38:44+00:00	Twitter Web App	None	None	None	1	Wann kandidiert #Petrovic offiziell für #MFG? #imzentrum
1482829695456624643	be_we	2022-01-16 21:38:43+00:00	Twitter for Android	None	None	None	0	Wovon redet dieser Verfassungsjurist? Weiß er nicht was "off-Label" bedeutet? #imzentrum
1482829648987766784	GerlindeKolbl	2022-01-16 21:38:32+00:00	Twitter for Android	None	None	None	0	RT @SchnablFranz: Man hätte Frau Petrovic zu Beginn mit ihren abstrusen Aussagen konfrontieren müssen, nicht die Bühne für weitere bereiten…
1482829627651469318	pia_pe	2022-01-16 21:38:27+00:00	Twitter Web App	None	None	None	0	Finde schön, dass Wiedermann-Schmidt all diese Zahlen hat. Wieso werden all diese Zahlen nicht besser kommuniziert?? #imZentrum
1482829599126036484	IBPartei	2022-01-16 21:38:20+00:00	Twitter for iPhone	None	None	None	1	Reißt euch einfach zusammen, ihr schafft das. #imzentrum https://t.co/BPq3cUKBBQ
1482829533762007055	S_o_v_i_e_r	2022-01-16 21:38:05+00:00	Twitter for Android	None	None	None	0	Zwei der drei roten Brillen eher schwierig. #imzentrum
1482829525247565825	liabellafi	2022-01-16 21:38:03+00:00	Twitter for iPhone	None	None	None	3	In welcher Funktion ist Madeleine Petrovic bei #imZentrum?
1482829491487584257	nunukaller	2022-01-16 21:37:55+00:00	Twitter Web App	None	None	None	0	RT @Natascha_Strobl: Petrovic betreibt klassische Desinformation und verdreht Tatsachen. Sie nimmt einen Passus heraus und suggeriert, dass…
1482829470180548609	harald_eff	2022-01-16 21:37:49+00:00	Twitter Web App	None	None	None	1	#Griss haut die eine minutenlange Ausführung von Kneihs mit einem Satz zusammen, Wiedermann-Schmidt die andere. #ImZentrum
1482829436152078343	Natascha_Strobl	2022-01-16 21:37:41+00:00	Twitter for iPhone	None	None	None	69	Es ist ein Wahnsinn, dass Reiterer so fragt, ob die Impfung überhaupt schützt. Es ist längst belegt. Millionen Mal. Und sie macht es auf, als bestünde da noch ein Zweifel. #imzentrum
1482829429550243843	BlondChristina	2022-01-16 21:37:40+00:00	Twitter for iPhone	None	None	None	0	RT @Robert_V_Schuh: #imzentrum Werter ORF, warum werden Privatpersonen (eigene Worte!) zu dem Thema Impfpflicht eingeladen? 😎
1482829415218393093	MonikaW75885050	2022-01-16 21:37:36+00:00	Twitter for Android	None	None	None	0	RT @Natascha_Strobl: Ohje, er weiß nicht was offlabel ist. #imzentrum
1482829355650797572	tollereise	2022-01-16 21:37:22+00:00	Twitter for iPhone	None	None	None	0	Der Schutz der Impfung ist FRÜHESTENS in 6-9 Monaten, denn es sagen ja alle „Nur der Booster schützt“ #imzentrum
1482829353293692935	RalfTometschek	2022-01-16 21:37:22+00:00	Twitter for iPhone	None	None	None	0	RT @SabineTreuer: #iz #imzentrum #theater warum ist eine impfpflicht ein eingriff in die menschenrechte,aber eine beschneidung von männl k…
1482829353193029647	RabemaniManuela	2022-01-16 21:37:22+00:00	Twitter Web App	None	None	None	0	RT @SchnablFranz: Man hätte Frau Petrovic zu Beginn mit ihren abstrusen Aussagen konfrontieren müssen, nicht die Bühne für weitere bereiten…
1482829334310178822	MrUlmrich	2022-01-16 21:37:17+00:00	Twitter Web App	None	None	None	0	I. Griss: Unterlassung ist auch ein Delikt. Soviel zum Thema Herumgeschwurbel #imzentrum
1482829279717175298	SabineTreuer	2022-01-16 21:37:04+00:00	Twitter Web App	None	None	None	6	#iz #imzentrum #theater warum ist eine impfpflicht ein eingriff in die menschenrechte,aber eine beschneidung von männl kindern aufgrund von religiösem wahn ist erlaubt von den menschenrechten? subjektivität im recht? man weiß es nicht
1482829247781785600	RobertGlattau	2022-01-16 21:36:56+00:00	TweetDeck	None	None	None	0	Fand ich interessant, was VerfRechtler #Kneihs zum „Tatbestand” ausführte: Dzt. wäre es der körperliche Zustand. Besser wäre die Nichteinhaltung eines Termins. #imzentrum #Impfpflicht
1482829189883613186	PeterCScholz	2022-01-16 21:36:43+00:00	Twitter for iPad	None	None	None	0	Wer vorbereitet Frau P.? Sie spricht im off mit irgend jemandem. #imzentrum
1482829173647413256	SecondraC	2022-01-16 21:36:39+00:00	Twitter for iPhone	None	None	None	0	#imzentrum danke, dass es noch echte Experten gibt! Super Auftritt Prof. Kneihs- „….zwang ist Themenverfehlung….“ ich lach mich über die Politiker kaputt echt! Die Griehs ist halt alt - entschuldbar ihre Verwirrungen @reiterec #Impfpflicht #oevpgameover #Oesterreich
1482829068760453134	Erich_Ulrich	2022-01-16 21:36:14+00:00	Twitter for iPhone	None	None	None	0	Der Mensch ist das Delikt und alles ist verfassungswidrig. Und wurscht ist es auch. Zusammenfassung #imzentrum unfassbar
1482829015849353217	stupmed	2022-01-16 21:36:01+00:00	Twitter for Android	1482827490020282369	1234060130574049281	BergheimJeff	0	@BergheimJeff @Hoellenaufsicht In #imzentrum sitzt eine ehemalige Grünenvorsitzende, die auf einer Antivaxxerdemo vorgetragen hat, dass alle die pro Impfung sind von Pfizer und Bill Gates bezahlt werden. 🥰
1482829000200404999	JoachimKovacs	2022-01-16 21:35:57+00:00	Twitter for Android	None	None	None	0	Dieses #imzentrum bringt uns jetzt genau was? Eine Situationsanalyse 🇦🇹 in der Pandemie? Am A****!
1482828969208692736	JoeFred111	2022-01-16 21:35:50+00:00	Twitter for Android	None	None	None	0	RT @Natascha_Strobl: Petrovic betreibt klassische Desinformation und verdreht Tatsachen. Sie nimmt einen Passus heraus und suggeriert, dass…
1482828942709035008	kamilszlachta	2022-01-16 21:35:44+00:00	Twitter Web App	None	None	None	0	petrovic kann genausowenig ins studio wie djokovic nach australien #imzentrum
1482828933280284677	Ha_Sch	2022-01-16 21:35:41+00:00	Twitter for Android	None	None	None	0	Fahrerflucht? mache nichts und fahre weiter. Auch ein Delikt oder? #imzentrum
1482828924807753731	RabemaniManuela	2022-01-16 21:35:39+00:00	Twitter Web App	None	None	None	0	RT @Natascha_Strobl: Petrovic betreibt klassische Desinformation und verdreht Tatsachen. Sie nimmt einen Passus heraus und suggeriert, dass…
1482828910815592449	MrUlmrich	2022-01-16 21:35:36+00:00	Twitter Web App	None	None	None	0	Off label?!? Hat der arme Mann ein Gliom, das funktionelles Gehirngewebe verdrängt? #imzentrum
1482828885830082567	TheStyrian	2022-01-16 21:35:30+00:00	Twitter Web App	None	None	None	1	Madeleine Petrovic würde nie in ein Impfzentrum gehen. Auch nicht, wenn's nur so ähnlich klingt. #imzentrum https://t.co/ENusTWWKto
1482828880721420295	gregoa_	2022-01-16 21:35:29+00:00	Twitter Web App	1482828433608646662	1144421354	MariaLodjn	0	@MariaLodjn dann zahlt herr ungeimpft genauso strafe wie wenn er zu schnell oder bei rot faehrt. #imzentrum
1482828857430482948	splinterfiber	2022-01-16 21:35:23+00:00	Twitter for iPhone	None	None	None	0	Why is there demand for Petrovic? #imzentrum #Impfpflicht
1482828831560028170	betterworldmax	2022-01-16 21:35:17+00:00	Twitter for iPhone	None	None	None	0	#petrovic schaut wie Prof. Gott Kupfer 😱 #imzentrum
1482828831509598214	walterra	2022-01-16 21:35:17+00:00	Twitter for iPad	None	None	None	1	FYI #imzentrum https://t.co/aYkgFFASfN
1482828769341718533	Natascha_Strobl	2022-01-16 21:35:02+00:00	Twitter for iPhone	None	None	None	3	Ohje, er weiß nicht was offlabel ist. #imzentrum
1482828764736372751	ICCzermak	2022-01-16 21:35:01+00:00	Twitter for Android	None	None	None	0	Womit begründet p ihren starken Vorbehalt gegenüber der Sicherheit der Impfstoffe?? Der Jurist sagt "zurecht"? #imzentrum
1482828733698433031	senad_lacevic	2022-01-16 21:34:54+00:00	Twitter for Android	None	None	None	10	Warum Leute wie #Petrovic zu Sendungen wie #imzentrum eingeladen werden? Sie bedeuten Interaktion, Aufregung und Interesse. Für eine vernüftige Diskussion über Sinn und Unsinn, Stärken und Schwächen des Entwurfes zur #Impfpflicht katastrophal, für die Quote gut.
1482828726379421696	mv2212	2022-01-16 21:34:52+00:00	Twitter for Android	None	None	None	0	RT @RaGaDACH: Aktuell werden in der Grazer Kinderklinik sechs Kinder stationär behandelt. Das Entzündungssyndrom #PIMS tritt selbst bei mil…
1482828662563033089	the_judas_tree	2022-01-16 21:34:37+00:00	Twitter for iPhone	None	None	None	1	Daß der @ORF einer Frau Petrović, noch eine extra Plattform bietet, ihre Desinformation, Gift und Verdrehung von Tatsachen und Fakten, in den Äther hinauszuposaunen, ist eine absolute Frechheit. Welchen Mehrwert bringt die Dame bitte in dieser Diskussion?! #imZentrum #orf2
1482828646528208902	Pulli_Ulli_	2022-01-16 21:34:33+00:00	Twitter Web App	None	None	None	0	Was. Will. Er. Sagen. #imzentrum
1482828634062835715	michaelwoegerer	2022-01-16 21:34:30+00:00	Twitter for Android	None	None	None	0	Erste Runde #imzentrum: Mehrheitlich kritische Stimmen zum vorliegenden #Impfpflicht-Gesetz aus unterschiedlichen Blickwinkeln
1482828616614490120	KatQuat	2022-01-16 21:34:26+00:00	Twitter for iPhone	None	None	None	0	ich isolier mich so gut es geht und schau auf andere. ich will meinen standpunkt auch vertreten wissen, frau petrovic #imzentrum
1482828610671198213	chris1899	2022-01-16 21:34:25+00:00	Twitter for iPhone	None	316488595	diegruenen	0	@diegruenen Was passiert mit Mitgliedern, genauer gesagt ihre ehemalige Bundessprecherin Petrovic, die Lügen und Fake News verbreiten? #imzentrum
1482828609718997001	thereal_bjoern	2022-01-16 21:34:24+00:00	Twitter for iPhone	None	None	None	0	Ich bin für einarmige Juristen, die können nicht sagen: on the one hand, …, on the other hand #imzentrum
1482828604555907072	JaMoEberl	2022-01-16 21:34:23+00:00	Twitter for iPhone	None	None	None	0	RT @Natascha_Strobl: Petrovic betreibt klassische Desinformation und verdreht Tatsachen. Sie nimmt einen Passus heraus und suggeriert, dass…
1482828583022247943	ListHeidi	2022-01-16 21:34:18+00:00	Twitter Web App	None	None	None	0	RT @bakhall: Wenn du eine Verfassungsjuristin bei wish bestellst. #imzentrum https://t.co/QKWpRLVPWm
1482828565574037513	MrUlmrich	2022-01-16 21:34:14+00:00	Twitter Web App	None	None	None	0	eine andere Atmosphäre... Von was red der Mensch? #imzentrum
1482828473051852800	DerGeidorfer	2022-01-16 21:33:52+00:00	Twitter for iPad	None	None	None	0	Kann bitte irgendwer zufällig einen Leitungsausfall verursachen? #imzentrum
1482828457721704449	broethaler	2022-01-16 21:33:48+00:00	Twitter for Android	None	None	None	1	Ich finde wirklich toll, dass GD Roland Weißmann den #ORF in Richtung #ServusTV führt. Fusion denkbar? #imzentrum https://t.co/KhBf7ccV4M
1482828445218443269	DuizendJensen	2022-01-16 21:33:45+00:00	Twitter Web App	None	None	None	0	RT @Natascha_Strobl: Petrovic betreibt klassische Desinformation und verdreht Tatsachen. Sie nimmt einen Passus heraus und suggeriert, dass…
1482828433608646662	MariaLodjn	2022-01-16 21:33:42+00:00	Twitter for iPhone	None	None	None	0	#imzentrum #Impfpflicht es ist wirklich ein so ein österreichisches Ding, leider! Ich sehe Probleme mit 3G am Arbeitsplatz. Wenn also Herr Ungeimpft zur Arbeit fährt, weil er das muss und darf. Wird aufgehalten, aber er muss ja arbeiten fahren - also doch 2G oder wie?
1482828387848798213	AnichPeter	2022-01-16 21:33:31+00:00	Twitter for Android	None	None	None	0	Der Herr Verfassungsjurist hat einen besonderen Modegeschmack ;-) #imzentrum
1482828338217603072	anjana_020	2022-01-16 21:33:20+00:00	Twitter Web App	None	None	None	0	Spö, Neos gespalten in Punkto Impfpflicht, nun plötzlich planlos, schnell die Impfpflicht. Das wird massive Diskussionen auslösen und dann lädt der Orf Petrovic ein?? #imzentrum
1482828284723404801	Pulli_Ulli_	2022-01-16 21:33:07+00:00	Twitter Web App	None	None	None	0	Juristen 🤯 #imzentrum
1482828268252418058	MrUlmrich	2022-01-16 21:33:03+00:00	Twitter Web App	1482827825619087360	254999614	tollereise	0	@tollereise Nein, genauso wie jemand, der in der 30er-Zone oder in einer Spielstrasse mit 131 fährt #imzentrum
1482828261482766337	WegWilfried	2022-01-16 21:33:01+00:00	Twitter for Android	None	None	None	0	RT @Natascha_Strobl: Petrovic betreibt klassische Desinformation und verdreht Tatsachen. Sie nimmt einen Passus heraus und suggeriert, dass…
1482828218298163202	marcus_didius	2022-01-16 21:32:51+00:00	Twitter for iPhone	None	None	None	0	RT @PatrickGruska: Sich seriös mit einem Thema zu beschäftigen und gleichzeitig dann "alle sind von Gates bezahlt" sagen geht sich genau wi…
1482828217283141643	wernerkeil	2022-01-16 21:32:51+00:00	Twitter for Android	None	None	None	0	RT @SherlockH85: Auf ORF 2 sitzen Griss und Petrovic, auf Servus TV sitzt das kastrierte Pferd 🤦‍♂️ #imzentrum #lrm https://t.co/Bt465fg7yf
1482828205774020613	bundesminista	2022-01-16 21:32:48+00:00	Twitter for iPhone	None	None	None	4	WAS IST MIT DEN BRILLEN #imzentrum https://t.co/BcJnMZ71Rc
1482828195074293765	LawinenL	2022-01-16 21:32:45+00:00	Twitter for Android	None	None	None	0	alter, die rote Brille macht mi so unrund. #imzentrum
1482828161922387968	DaDemir2911	2022-01-16 21:32:38+00:00	Twitter Web App	None	None	None	0	Spott gegenüber fundamentalistischen Glaubensfragen, ist übrigens eine der essenziellen Bedingungen menschlicher Emanzipation. Bei Schwurblern kommt man mit rationalen Argumenten nicht weiter. Spott ist hier nicht nur legitimiert, sondern notwendig. #imzentrum #petrovic
1482828135754309634	mv2212	2022-01-16 21:32:31+00:00	Twitter for Android	None	None	None	0	RT @Robert_V_Schuh: #imzentrum Werter ORF, warum werden Privatpersonen (eigene Worte!) zu dem Thema Impfpflicht eingeladen? 😎
1482828074026774532	feletmel	2022-01-16 21:32:17+00:00	Twitter for Android	None	None	None	0	RT @WernerReisinger: verstehe nicht ganz, wieso man als @orf jmd der wie madeleine petrovic eine solche bühne bietet. #imzentrum #zib2
1482828063796834323	SchmellerC	2022-01-16 21:32:14+00:00	Twitter for iPad	None	None	None	0	RT @gandi80: Also sollte #Petrovic nur von Dingen sprechen von denen sie Ahnung hat, Impfstoffe sind es definitiv nicht #ImZentrum
1482828049213235206	SecondraC	2022-01-16 21:32:11+00:00	Twitter for iPhone	None	None	None	0	Es ist aus Karli. - Hat Nehammer guten Rechtsanwalt? Verteidigt ihn überhaupt jemand ab nächster Woche wenn ihn alle - ALLE - verlassen? RS steigt aus hab ich gehört …such a shame. Ihr habt es vergeigt. #Impfpflicht #Spaziergang #imzentrum #IdenDesMärz #Rubicon #nemesis
1482828036630269956	gmpinter	2022-01-16 21:32:08+00:00	Twitter Web App	None	None	None	0	RT @Natascha_Strobl: Petrovic betreibt klassische Desinformation und verdreht Tatsachen. Sie nimmt einen Passus heraus und suggeriert, dass…
1482828018661961728	lou_jbara	2022-01-16 21:32:03+00:00	Twitter for iPhone	None	None	None	0	Nächste Woche ist dann Wendler live dazu geschalten oder? #imzentrum
1482828010621386753	echeloni2p	2022-01-16 21:32:02+00:00	Twitter for Android	None	None	None	0	RT @Natascha_Strobl: Petrovic betreibt klassische Desinformation und verdreht Tatsachen. Sie nimmt einen Passus heraus und suggeriert, dass…
1482827997925330945	peterholubar	2022-01-16 21:31:58+00:00	Twitter for iPhone	1482826986779197441	770248848	PatrickGruska	1	@PatrickGruska Sie hat betont, dass sie als Juristin und Privatperson dort ist. Das ist schwach, weil als Privatperson wäre sie wohl nicht zu #ImZentrum eingeladen worden. #SchwurbelWatch
1482827944607236101	MaxlWerner	2022-01-16 21:31:46+00:00	Twitter Web App	None	None	None	0	wann bekomm ich endlich mein geld von bill gates? #ImZentrum
1482827934054428678	Ha_Sch	2022-01-16 21:31:43+00:00	Twitter for Android	None	None	None	0	auf was hinauf darf Petrovic als Frau/Privatperson hier ihren Standpunkt rausposaunen? #imzentrum
1482827921165279232	Matthau63	2022-01-16 21:31:40+00:00	Twitter for Android	None	None	None	0	RT @mozartelfe: @Natascha_Strobl Deshalb braucht's eigentlich bei jedem #imzentrum DRINGEND einen Faktenchecker/eine Faktencheckerin im Stu…
1482827918933999618	LawinenL	2022-01-16 21:31:40+00:00	Twitter for Android	None	None	None	0	hams keinen anderen schwurbler (umbaut) gefunden, oder was ist die Rolle von der Petrovic? #imzentrum
1482827887124353035	ChiquititaRa	2022-01-16 21:31:32+00:00	Twitter for iPad	None	None	None	0	RT @PaulReisenauer: Ich bin keine Medizinerin. Aber als Frau, Großmutter und Patin vom Esel Flecki möchte ich meinen Standpunkt vertreten w…
1482827860561780736	WegWilfried	2022-01-16 21:31:26+00:00	Twitter for Android	None	None	None	0	RT @liviaklingl: #MadeleinePetrovic spricht "als frau". was hat ihr geschlecht mit der beurteilung der impffrage zu tun, frage ich so als…
1482827846603128834	SimonTschannett	2022-01-16 21:31:22+00:00	Twitter for iPhone	None	None	None	0	RT @Natascha_Strobl: Petrovic betreibt klassische Desinformation und verdreht Tatsachen. Sie nimmt einen Passus heraus und suggeriert, dass…
1482827832627769344	SebRei	2022-01-16 21:31:19+00:00	Twitter for Android	None	None	None	0	RT @Natascha_Strobl: Petrovic betreibt klassische Desinformation und verdreht Tatsachen. Sie nimmt einen Passus heraus und suggeriert, dass…
1482827831960875008	realpinkbanana	2022-01-16 21:31:19+00:00	Twitter for iPhone	None	None	None	0	#imzentrum beliebteste Second Screen Sendung in Österreich, oder? 😉
1482827800742617089	alwynmattathil	2022-01-16 21:31:11+00:00	Twitter for Android	None	None	None	0	RT @allesmittelgrau: Petrović sagt sie kann das nicht so gut einschätzen, da sie Juristin sei. Im nächsten Satz Einschätzung zur Impfung. #…
1482827799819870208	zuina_bua	2022-01-16 21:31:11+00:00	Twitter for iPhone	None	None	None	0	Frau P. kann nicht offen sprechen, weil sie der Gummibaum abhört. Oder so. #imzentrum
